creator,title
Nassim Nicholas Taleb,"The Black Swan: Second Edition: The Impact of the Highly Improbable: With a new section: ""On Robustness and Fragility"""
Andrew S. Tanenbaum,Modern Operating Systems
Bruce Tate,Seven Languages in Seven Weeks: A Pragmatic Guide to Learning Programming Languages
"Bruce Tate, Justin Gehtland",Spring: A Developer's Notebook
"Alexander Taub, Ellen DaSilva","Pitching and Closing: Everything You Need to Know About Business Development, Partnerships, and Making Deals that Matter"
Adobe Creative Team,Official Adobe Print Publishing Guide
"Dennis Tedlock, Barbara Tedlock",Teachings from the American Earth: Indian Religion and Philosophy
"Toby J. Teorey, Sam S. Lightstone, Tom Nadeau, H.V. Jagadish","Database Modeling and Design, Fifth Edition: Logical Design"
Studs Terkel,Hard Times: An Oral History of the Great Depression
"Thucydides, M. I. Finley",History of the Peloponnesian War
James Tiptree Jr.,Her Smoke Rose Up Forever
Alvin Toffler,Future Shock
John Toland,Adolf Hitler Vol II
John Toland,"Adolf Hitler, Vol. 1"
John Kennedy Toole,A Confederacy of Dunces
"Linus Torvalds, David Diamond",Just for Fun: The Story of an Accidental Revolutionary
Nick Tosches,Where Dead Voices Gather
Bruce Tremper,"Staying Alive in Avalanche Terrain, 2nd Ed."
Edward R. Tufte,Beautiful Evidence
Edward R. Tufte,Envisioning Information
Edward R. Tufte,The Visual Display of Quantitative Information
Edward R. Tufte,"Visual Explanations: Images and Quantities, Evidence and Narrative"
Homer Ulrich,Symphonic Music
John Updike,The Coup: A Novel
John Updike,Rabbit at Rest
John Updike,Rabbit Is Rich
John Updike,Rabbit Redux
John Updike,"Rabbit, Run"
Leon Uris,Trinity
Jeff VanderMeer,Annihilation: A Novel
Jeff VanderMeer,Authority: A Novel
Jeff VanderMeer,Borne: A Novel
Jeff VanderMeer,City of Saints and Madmen
Jeff VanderMeer,Finch
Jeff VanderMeer,Shriek: An Afterword
Jeff VanderMeer,The Third Bear
Jeff VanderMeer,Veniss Underground
Abraham Verghese,Cutting for Stone
Vernor Vinge,The Children of the Sky
Vernor Vinge,The Collected Stories of Vernor Vinge
Vernor Vinge,Deepness in the Sky
Vernor Vinge,A Fire Upon The Deep
Vernor Vinge,Marooned in Realtime
Vernor Vinge,The Peace War
Vernor Vinge,Rainbows End: A Novel With One Foot In The Future
Vernor Vinge,Tatja Grimm's World
Vernor Vinge,The Witling
Georgi Vladimov,Faithful Ruslan
Ellen Bryant Voigt,Headwaters: Poems
Voltaire,Candide
Voltaire,Candide: Or Optimism
Kurt Vonnegut,Breakfast of Champions: A Novel
Kurt Vonnegut,Cat's Cradle: A Novel
Kurt Vonnegut,Galapagos: A Novel
Kurt Vonnegut,"God Bless You, Mr. Rosewater"
Kurt Vonnegut,Player Piano: A Novel
Kurt Vonnegut,Slaughterhouse-Five
Kurt Vonnegut,Slaughterhouse-Five: A Novel
Kurt Vonnegut,"Wampeters, Foma & Granfalloons:"
Sarah Vowell,Assassination Vacation
Sarah Vowell,Lafayette in the Somewhat United States
Sarah Vowell,The Partly Cloudy Patriot
Sarah Vowell,Radio On: A Listener's Diary
Sarah Vowell,Take the Cannoli: Stories From the New World
Sarah Vowell,The Wordy Shipmates
Frans B. M. de Waal,Good Natured: The Origins of Right and Wrong in Humans and Other Animals
M. Mitchell Waldrop,Complexity: The Emerging Science at the Edge of Order and Chaos
"Larry Wall, Tom Christiansen, Jon Orwant",Programming Perl
"Craig Walls, Ryan Breidenbach",Spring in Action
"David Ward, Noel Radomski",Proud Traditions and Future Challenges: The University of Wisconsin–Madison Celebrates 150 Years
Dean Wareham,Black Postcards: A Rock & Roll Romance
"David Weinberger, Rick Levine, Christopher Locke, Doc Searls",The Cluetrain Manifesto
Nathanael West,Miss Lonelyhearts & the Day of the Locust
Scott Westerfeld,The Killing of Worlds: Book Two of Succession
Scott Westerfeld,The Risen Empire
Edmund White,Genet: A Biography
"Mark Wilcox, Marc Wilcox",Implementing LDAP
Sam Williams,Free as in Freedom: Richard Stallman's Crusade for Free Software
Edwin Williamson,Borges: A Life
Connie Willis,All Clear
Connie Willis,Blackout
"Paul Wilmott, Sam Howison, Jeff Dewynne",The Mathematics of Financial Derivatives: A Student Introduction
Laura Wingerd,Practical Perforce: Channeling the Flow of Change in Software Development Collaboration
Patrick Winston,Artificial Intelligence
"Patrick Winston, Berthold Horn",Lisp
Ben H. Winters,Countdown City: The Last Policeman Book II
Ben H. Winters,The Last Policeman
Ben H. Winters,World of Trouble: The Last Policeman Book III
"Liz Wiseman, Greg Mckeown",Multipliers: How the Best Leaders Make Everyone Smarter
Ludwig Wittgenstein,The Blue and Brown Books
Ludwig Wittgenstein,Tractatus Logico-Philosophicus: German and English
Monique Wittig,L'opoponax: Roman
Michael Wolff,Burn Rate: How I Survived the Gold Rush Years on the Internet
Stephen Wolfram,A New Kind of Science
Stanley Wolpert,A New History of India
"Bob Woodward, Carl Bernstein",All the President's Men
"Bob Woodward, Carl Bernstein",The Final Days
Virginia Woolf,Mrs. Dalloway
Virginia Woolf,A Room of One's Own
J. Patrick Wright,On a Clear Day You Can See General Motors: John Z. DeLorean's Look Inside the Automotive Giant
"Malcolm X, Alex Haley, Attallah Shabazz",The Autobiography of Malcolm X: As Told to Alex Haley
Toby Young,How to Lose Friends & Alienate People
Nicholas C. Zakas,Professional JavaScript for Web Developers
Roger Zelazny,Creatures of Light and Darkness
Roger Zelazny,"The Doors of His Face, The Lamp of His Mouth"
Roger Zelazny,"The Great Book of Amber: The Complete Amber Chronicles, 1-10"
Roger Zelazny,Last Defender of Camelot
Roger Zelazny,Lord of Light
Cecily von Ziegesar,Gossip Girl: Because I'm Worth It
Jonathan Zittrain,The Future of the Internet--And How to Stop It
Stefan Zweig,The Collected Stories of Stefan Zweig
